Name,Description,Latitude,Longitude,InfoURL,ImageURL
UCSB,A great university located along california coast!,34.416929,-119.845991,"https://en.wikipedia.org/wiki/University_of_California, _Santa_Barbara",https://www.news.ucsb.edu/sites/default/files/styles/article_horizontal/public/images/2019/perko-storke-tower-5_0.jpg?itok=pXFH09HV
Hueneme High School,"a small local high school, where I remember fondly of my marching band years",34.160556,-119.181944,https://en.wikipedia.org/wiki/Hueneme_High_School,https://i2.wp.com/www.oxnardunion.org/wp-content/uploads/2020/01/hhs-gym-2.jpg?fit=1024%2C576&ssl=1
Hueneme Beach Park,"a beach that is within 10 minute walking distance that is always calm,and relaxing. most of my free time during summer would be hanging out here.",34.141944,-119.193056,https://www.ci.port-hueneme.ca.us/1168/Hueneme-Beach-Park,https://www.ci.port-hueneme.ca.us/ImageRepository/Document?documentID=1948
Bubbling Springs Park,a long park that follows a pring that eventually leads up to the beach.,34.156944,-119.192222,https://www.ci.port-hueneme.ca.us/1166/Bubbling-Springs-Park,https://www.arcadiaweekly.com/wp-content/uploads/2019/06/web-brook.jpg
Pacific View Mall,A mall in Ventura that houses big department stores such as Macys. There are more than 60 businesses residing in this mall.,34.269722,-119.248611,https://en.wikipedia.org/wiki/Pacific_View_Mall,https://upload.wikimedia.org/wikipedia/commons/3/3c/Pacific_View_Mall.JPG
The Collection Riverpark,"an outdoor center with a collection of big stores such as target, whole foods, and other retailers, and a cinema is included.",34.240556,-119.177222,https://en.wikipedia.org/wiki/The_Collection_at_RiverPark,https://upload.wikimedia.org/wikipedia/commons/a/a1/StarBucks-schafphoto-delivered-2356.jpg